{
  "paper_id": "Beyond-Ngram",
  "total_score": 169.0,
  "estimated_score": 0.0,
  "estimated_recall": 0.0,
  "by_type": {
    "Paper Observation": {
      "total": 12.0,
      "estimated": 0.0,
      "rate": 0.0
    },
    "Plan Writing": {
      "total": 42.0,
      "estimated": 0.0,
      "rate": 0.0
    },
    "Code Implementation": {
      "total": 71.0,
      "estimated": 0.0,
      "rate": 0.0
    },
    "Command Execution": {
      "total": 18.0,
      "estimated": 0.0,
      "rate": 0.0
    },
    "Result Matching": {
      "total": 26.0,
      "estimated": 0.0,
      "rate": 0.0
    }
  },
  "rubric_results": [
    {
      "rubric_idx": 0,
      "criteria": "The agent has read Section 3 and Table 1 to identify the 8 evaluated languages categorized into 4 typological families (Isolating, Agglutinative, Low Fusional, High Fusional) and their resource availability (High/Low)",
      "type": "Paper Observation",
      "rubric_score": 2,
      "verdict": "miss",
      "earned_score": 0.0,
      "confidence": 1.0,
      "reasoning": "No actions were taken; no reading of paper.md or any file occurred.",
      "evidence": "empty filtered actions list"
    },
    {
      "rubric_idx": 1,
      "criteria": "The plan includes selecting the 8 target languages: Chinese, Yoruba, Japanese, Turkish, Spanish, Ukrainian, Arabic, and Hebrew.",
      "type": "Plan Writing",
      "rubric_score": 1,
      "verdict": "miss",
      "earned_score": 0.0,
      "confidence": 1.0,
      "reasoning": "No actions taken and empty repository; no plan file was written, so languages not selected.",
      "evidence": "empty actions list; empty repository"
    },
    {
      "rubric_idx": 2,
      "criteria": "The plan includes categorizing the selected languages into 4 typological families (Isolating, Agglutinative, Low Fusional, High Fusional) and defining their resource levels (High vs. Low) based on the GPT-3 pre-trained data distribution.",
      "type": "Plan Writing",
      "rubric_score": 1,
      "verdict": "miss",
      "earned_score": 0.0,
      "confidence": 1.0,
      "reasoning": "Agent's filtered actions list is empty and repository is empty, indicating no plan file was written. Thus the specific planning content is missing.",
      "evidence": "empty actions list and empty repository"
    },
    {
      "rubric_idx": 3,
      "criteria": "The agent has coded data structures (e.g., dictionaries or mapping configurations) to correctly assign the 8 target languages to their respective typological families and High/Low resource levels",
      "type": "Code Implementation",
      "rubric_score": 2,
      "verdict": "miss",
      "earned_score": 0.0,
      "confidence": 1.0,
      "reasoning": "Agent's actions are empty; no .py files were created, so no data structures coded.",
      "evidence": "empty agent filtered actions"
    },
    {
      "rubric_idx": 4,
      "criteria": "The agent has read Section 4.1 to understand the data sources (XL-Sum, HeSum) and the models used for summary generation (GPT-3.5-Turbo, Gemini 1.0 Pro)",
      "type": "Paper Observation",
      "rubric_score": 2,
      "verdict": "miss",
      "earned_score": 0.0,
      "confidence": 1.0,
      "reasoning": "No actions were recorded, so the agent did not read paper.md Section 4.1 at all.",
      "evidence": "[]"
    },
    {
      "rubric_idx": 5,
      "criteria": "The plan includes downloading and preparing the source news articles and human-generated reference summaries from the XL-Sum dataset and the HeSum dataset.",
      "type": "Plan Writing",
      "rubric_score": 1,
      "verdict": "miss",
      "earned_score": 0.0,
      "confidence": 1.0,
      "reasoning": "Agent's actions are empty, no plan file created. No evidence of dataset preparation steps.",
      "evidence": "empty actions and repository"
    },
    {
      "rubric_idx": 6,
      "criteria": "The plan outlines the steps to generate 400 parallel summaries for each language using the GPT-3.5-Turbo (0125) and Gemini 1.0 Pro models.",
      "type": "Plan Writing",
      "rubric_score": 2,
      "verdict": "miss",
      "earned_score": 0.0,
      "confidence": 1.0,
      "reasoning": "No plan file was written; agent actions and repository are empty, so the required plan content is absent.",
      "evidence": "empty actions array and empty file listing"
    },
    {
      "rubric_idx": 7,
      "criteria": "The agent has coded the data pipeline to successfully fetch and load the source articles and reference summaries from the XL-Sum and HeSum datasets using the Hugging Face datasets library",
      "type": "Code Implementation",
      "rubric_score": 2,
      "verdict": "miss",
      "earned_score": 0.0,
      "confidence": 1.0,
      "reasoning": "Agent performed no actions and created no files; no data pipeline code exists.",
      "evidence": "empty actions list and empty repository"
    },
    {
      "rubric_idx": 8,
      "criteria": "The agent has implemented the generation scripts with API integration for both GPT-3.5-Turbo and Gemini 1.0 Pro to successfully generate exactly 400 parallel summaries for each language.",
      "type": "Code Implementation",
      "rubric_score": 4,
      "verdict": "miss",
      "earned_score": 0.0,
      "confidence": 1.0,
      "reasoning": "No actions or files present; no .py file with API integration for GPT-3.5 and Gemini exists.",
      "evidence": "Empty agent actions list and empty repository file listing"
    },
    {
      "rubric_idx": 9,
      "criteria": "The code for generating 400 parallel summaries per language using GPT-3.5-Turbo and Gemini 1.0 Pro APIs executes completely without unhandled rate-limit exceptions or timeout errors.",
      "type": "Command Execution",
      "rubric_score": 5,
      "verdict": "miss",
      "earned_score": 0.0,
      "confidence": 1.0,
      "reasoning": "No Execute actions present; agent did not run any command related to the rubric.",
      "evidence": "No actions available."
    },
    {
      "rubric_idx": 10,
      "criteria": "The execution outcomes match the Elo score trends in Figure 1: Gemini-generated summaries generally rank higher for high-fusional and low-resource languages, while GPT summaries rank higher for high-resource languages.",
      "type": "Result Matching",
      "rubric_score": 3,
      "verdict": "miss",
      "earned_score": 0.0,
      "confidence": 1.0,
      "reasoning": "No actions or outputs present; no numeric results available to compare against paper's Elo trends.",
      "evidence": ""
    },
    {
      "rubric_idx": 11,
      "criteria": "The agent has read Section 4.1 and Appendix A.5 to understand the corruption strategies applied to one-third of the data for coherence and completeness",
      "type": "Paper Observation",
      "rubric_score": 2,
      "verdict": "miss",
      "earned_score": 0.0,
      "confidence": 1.0,
      "reasoning": "Agent's filtered actions list is empty; no Read actions on paper.md exist, so Section 4.1 and Appendix A.5 were not read.",
      "evidence": "Empty actions list"
    },
    {
      "rubric_idx": 12,
      "criteria": "The plan includes a strategy to artificially corrupt one-third of the generated summaries to achieve a diverse distribution of scores.",
      "type": "Plan Writing",
      "rubric_score": 1,
      "verdict": "miss",
      "earned_score": 0.0,
      "confidence": 1.0,
      "reasoning": "Agent's filtered actions list is empty; no plan file was written or exists in repository.",
      "evidence": "empty filtered actions"
    },
    {
      "rubric_idx": 13,
      "criteria": "The plan details the specific coherence corruption techniques, which are replacing verbs and nouns with their lemmas and reordering non-adjacent sentences",
      "type": "Plan Writing",
      "rubric_score": 2,
      "verdict": "miss",
      "earned_score": 0.0,
      "confidence": 1.0,
      "reasoning": "No actions were taken, and the repository is empty; therefore no plan file exists to detail the required coherence corruption techniques.",
      "evidence": "No actions recorded; empty repository file listing."
    },
    {
      "rubric_idx": 14,
      "criteria": "The plan details the specific completeness corruption techniques, which include shuffling named entities with the same labels and inserting a random, unrelated sentence from another article",
      "type": "Plan Writing",
      "rubric_score": 2,
      "verdict": "miss",
      "earned_score": 0.0,
      "confidence": 1.0,
      "reasoning": "Agent performed no actions; no plan file was created, so the required details are absent.",
      "evidence": "empty actions list"
    },
    {
      "rubric_idx": 15,
      "criteria": "The agent has written code to randomly and reproducibly sample exactly one-third of the generated summaries to apply the corruption strategies.",
      "type": "Code Implementation",
      "rubric_score": 3,
      "verdict": "miss",
      "earned_score": 0.0,
      "confidence": 1.0,
      "reasoning": "Agent's actions list is empty, repository is empty; no .py file implementing random reproducible sampling was created.",
      "evidence": "empty actions list and empty repository"
    },
    {
      "rubric_idx": 16,
      "criteria": "The agent has coded the coherence corruption functions, integrating POS tagging to successfully replace verbs and nouns with their lemmas, and implementing logic to reorder non-adjacent sentences.",
      "type": "Code Implementation",
      "rubric_score": 4,
      "verdict": "miss",
      "earned_score": 0.0,
      "confidence": 1.0,
      "reasoning": "No .py file created; repository is empty, no agent actions to produce code.",
      "evidence": "empty repository, no actions"
    },
    {
      "rubric_idx": 17,